{
  "$schema": "https://json-schema.org/draft/2020-12/schema",
  "title": "Code Review Findings",
  "description": "Output schema for the codereview skill. Contains envelope metadata and an array of findings from deterministic and AI review passes.",
  "type": "object",
  "required": ["run_id", "timestamp", "scope", "base_ref", "head_ref", "verdict", "verdict_reason", "strengths", "files_reviewed", "tool_status", "findings", "tier_summary", "spec_requirements", "review_mode"],
  "properties": {
    "review_mode": {
      "type": "string",
      "enum": ["standard", "chunked"],
      "description": "Whether the review used standard mode or chunked mode for large changesets"
    },
    "chunk_count": {
      "type": ["integer", "null"],
      "description": "Number of review chunks (null or omitted in standard mode)"
    },
    "chunks": {
      "type": ["array", "null"],
      "description": "Chunk metadata for chunked reviews (null or omitted in standard mode)",
      "items": {
        "type": "object",
        "required": ["id", "description", "files", "file_count", "diff_lines", "risk_tier"],
        "properties": {
          "id": {
            "type": "integer",
            "description": "Sequential chunk ID (1, 2, 3, ...)"
          },
          "description": {
            "type": "string",
            "description": "Directory path(s) covered by this chunk"
          },
          "files": {
            "type": "array",
            "items": { "type": "string" },
            "description": "File paths in this chunk"
          },
          "file_count": {
            "type": "integer",
            "description": "Number of files in this chunk"
          },
          "diff_lines": {
            "type": "integer",
            "description": "Total lines changed in this chunk"
          },
          "risk_tier": {
            "type": "string",
            "enum": ["critical", "standard", "low-risk"],
            "description": "Highest risk tier of any file in this chunk"
          },
          "passes_run": {
            "type": "integer",
            "description": "Number of explorer passes that reviewed this chunk"
          },
          "findings": {
            "type": "integer",
            "description": "Number of findings from explorers for this chunk"
          }
        }
      }
    },
    "run_id": {
      "type": "string",
      "description": "Unique identifier for this review run (ISO timestamp + short hash)"
    },
    "timestamp": {
      "type": "string",
      "format": "date-time",
      "description": "ISO 8601 timestamp of when the review started"
    },
    "scope": {
      "type": "string",
      "enum": ["branch", "range", "staged", "commit", "pr", "path"],
      "description": "What kind of diff was reviewed"
    },
    "base_ref": {
      "type": "string",
      "description": "Base reference (branch name, commit SHA, or PR base)"
    },
    "head_ref": {
      "type": "string",
      "description": "Head reference (branch name, commit SHA, or PR head)"
    },
    "pr_number": {
      "type": ["integer", "null"],
      "description": "PR number if reviewing a pull request, null otherwise"
    },
    "files_reviewed": {
      "type": "array",
      "items": { "type": "string" },
      "description": "List of file paths included in the diff"
    },
    "verdict": {
      "type": "string",
      "enum": ["PASS", "WARN", "FAIL"],
      "description": "Overall merge readiness verdict. PASS: no must-fix issues. WARN: has should-fix issues but no blockers. FAIL: has must-fix issues that block merge."
    },
    "verdict_reason": {
      "type": "string",
      "description": "1-2 sentence explanation of the verdict"
    },
    "strengths": {
      "type": "array",
      "items": { "type": "string" },
      "description": "2-3 things done well in this change, identified by the review judge"
    },
    "spec_gaps": {
      "type": "array",
      "items": { "type": "string" },
      "description": "Requirements from the spec not addressed by the diff. Empty array if no spec was provided. Derived from spec_requirements for backward compatibility."
    },
    "spec_requirements": {
      "type": "array",
      "items": {
        "type": "object",
        "required": ["id", "text", "source_section", "impl_status"],
        "properties": {
          "id": {
            "type": "string",
            "description": "Stable requirement ID: REQ-001, REQ-002, etc."
          },
          "text": {
            "type": "string",
            "description": "The requirement text as extracted from the spec"
          },
          "source_section": {
            "type": "string",
            "description": "The spec section/heading this requirement was found in"
          },
          "priority": {
            "type": "string",
            "enum": ["must", "should", "could", "informational"],
            "description": "Priority inferred from language: must/shall=must, should=should, could/may=could, else informational"
          },
          "impl_status": {
            "type": "string",
            "enum": ["implemented", "partial", "not_implemented", "cannot_determine"],
            "description": "Whether the diff addresses this requirement"
          },
          "impl_evidence": {
            "type": ["string", "null"],
            "description": "File:line references showing where the requirement is implemented, or why it is not"
          },
          "impl_files": {
            "type": "array",
            "items": { "type": "string" },
            "description": "Files in the diff that implement this requirement"
          },
          "test_coverage": {
            "type": "object",
            "properties": {
              "status": {
                "type": "string",
                "enum": ["covered", "partial", "missing", "not_applicable"],
                "description": "Overall test coverage status for this requirement"
              },
              "tests": {
                "type": "array",
                "items": {
                  "type": "object",
                  "properties": {
                    "file": { "type": "string" },
                    "name": { "type": "string", "description": "Test function/method name" },
                    "category": {
                      "type": "string",
                      "enum": ["unit", "integration", "e2e", "unknown"],
                      "description": "Classified test category"
                    },
                    "category_evidence": {
                      "type": "string",
                      "description": "Why this test was classified in this category"
                    }
                  }
                },
                "description": "Tests that cover this requirement"
              },
              "needed_categories": {
                "type": "array",
                "items": { "type": "string", "enum": ["unit", "integration", "e2e"] },
                "description": "Test categories that should exist for this requirement but are missing"
              },
              "category_gap_reason": {
                "type": ["string", "null"],
                "description": "Why specific test categories are needed (e.g., 'Crosses service boundary, needs integration test')"
              }
            }
          }
        }
      },
      "description": "Per-requirement implementation and test coverage traceability. Populated when --spec is provided, empty array otherwise."
    },
    "tool_status": {
      "type": "object",
      "description": "Status of each tool/pass that was attempted. Keys include deterministic scan tools (semgrep, trivy, etc.), AI passes (ai_correctness, ai_security, etc.), and coverage tools (coverage_go, coverage_python, coverage_rust, coverage_typescript).",
      "additionalProperties": {
        "type": "object",
        "required": ["status"],
        "properties": {
          "status": {
            "type": "string",
            "enum": ["ran", "skipped", "failed", "not_installed", "sandbox_blocked", "partial"]
          },
          "version": {
            "type": ["string", "null"]
          },
          "finding_count": {
            "type": "integer"
          },
          "note": {
            "type": ["string", "null"],
            "description": "Why skipped/failed, or install hint"
          }
        }
      }
    },
    "findings": {
      "type": "array",
      "items": {
        "type": "object",
        "required": ["id", "source", "pass", "severity", "confidence", "file", "line", "summary"],
        "properties": {
          "id": {
            "type": "string",
            "description": "Stable finding ID: <pass>-<file-hash>-<line>"
          },
          "source": {
            "type": "string",
            "enum": ["deterministic", "ai"],
            "description": "Whether this came from a deterministic tool or an AI pass"
          },
          "pass": {
            "type": "string",
            "enum": ["correctness", "security", "reliability", "performance", "testing", "maintainability", "spec_verification"],
            "description": "Which review pass produced this finding"
          },
          "severity": {
            "type": "string",
            "enum": ["low", "medium", "high", "critical"]
          },
          "confidence": {
            "type": "number",
            "minimum": 0.0,
            "maximum": 1.0,
            "description": "Confidence score. AI findings below 0.65 are suppressed."
          },
          "file": {
            "type": "string",
            "description": "Relative path to the file"
          },
          "line": {
            "type": "integer",
            "minimum": 0,
            "description": "Line number (0 if file-level finding)"
          },
          "summary": {
            "type": "string",
            "description": "One-line issue statement"
          },
          "sources": {
            "type": "array",
            "items": { "type": "string" },
            "description": "Optional provenance list for deduplicated findings (e.g., [\"semgrep\", \"sonarqube\"])."
          },
          "evidence": {
            "type": ["string", "null"],
            "description": "Concrete evidence: code snippet, tool output, or reproduction steps"
          },
          "failure_mode": {
            "type": ["string", "null"],
            "description": "What breaks and when. Required for high/critical severity."
          },
          "fix": {
            "type": ["string", "null"],
            "description": "Smallest safe remediation"
          },
          "tests_to_add": {
            "type": "array",
            "items": { "type": "string" },
            "description": "Suggested test scenarios to cover this finding"
          },
          "test_category_needed": {
            "type": "array",
            "items": { "type": "string", "enum": ["unit", "integration", "e2e"] },
            "description": "Which categories of tests are needed for this finding"
          },
          "action_tier": {
            "type": "string",
            "enum": ["must_fix", "should_fix", "consider"],
            "description": "Action tier: must_fix (critical/high, conf>=0.80), should_fix (medium or high 0.65-0.79), consider (everything else above confidence floor)"
          },
          "fingerprint": {
            "type": "string",
            "description": "SHA-256 fingerprint (12 hex chars) for cross-review tracking"
          },
          "lifecycle_status": {
            "type": "string",
            "enum": ["new", "recurring"],
            "description": "Whether this finding appeared in a previous review"
          }
        }
      }
    },
    "suppressed_findings": {
      "type": "array",
      "description": "Findings suppressed via .codereview-suppressions.json (rejected or deferred). Same shape as findings but with lifecycle_status of rejected or deferred.",
      "items": {
        "type": "object",
        "properties": {
          "id": { "type": "string" },
          "source": { "type": "string", "enum": ["deterministic", "ai"] },
          "pass": { "type": "string" },
          "severity": { "type": "string", "enum": ["low", "medium", "high", "critical"] },
          "confidence": { "type": "number", "minimum": 0.0, "maximum": 1.0 },
          "file": { "type": "string" },
          "line": { "type": "integer", "minimum": 0 },
          "summary": { "type": "string" },
          "evidence": { "type": ["string", "null"] },
          "failure_mode": { "type": ["string", "null"] },
          "fix": { "type": ["string", "null"] },
          "action_tier": { "type": "string", "enum": ["must_fix", "should_fix", "consider"] },
          "fingerprint": { "type": "string", "description": "SHA-256 fingerprint (12 hex chars) for cross-review tracking" },
          "lifecycle_status": {
            "type": "string",
            "enum": ["rejected", "deferred"],
            "description": "Suppression status: rejected (permanently dismissed) or deferred (temporarily dismissed)"
          }
        }
      }
    },
    "lifecycle_summary": {
      "type": "object",
      "description": "Counts of findings by lifecycle status",
      "properties": {
        "new": { "type": "integer", "description": "Findings appearing for the first time" },
        "recurring": { "type": "integer", "description": "Findings that appeared in a previous review" },
        "rejected": { "type": "integer", "description": "Findings permanently suppressed" },
        "deferred": { "type": "integer", "description": "Findings temporarily suppressed" },
        "deferred_resurfaced": { "type": "integer", "description": "Previously deferred findings that resurfaced" }
      }
    },
    "tier_summary": {
      "type": "object",
      "description": "Count of findings per action tier",
      "properties": {
        "must_fix": { "type": "integer" },
        "should_fix": { "type": "integer" },
        "consider": { "type": "integer" }
      }
    },
    "_timing": {
      "type": ["object", "null"],
      "description": "Observability timing data for the review pipeline. Optional — omit if timing.sh was not available.",
      "properties": {
        "total_ms": { "type": "integer" },
        "steps": {
          "type": "array",
          "items": {
            "type": "object",
            "properties": {
              "name": { "type": "string" },
              "duration_ms": { "type": "integer" }
            }
          }
        },
        "marks": {
          "type": "array",
          "items": {
            "type": "object",
            "properties": {
              "name": { "type": "string" },
              "value": { "type": "string" },
              "ts": { "type": "string" }
            }
          }
        }
      }
    }
  }
}
